email,firstName,lastName,certificationName,status,message
emasaif231123@gmail.com,ايمان حسين حسن حسن على,ايمان حسين حسن حسن على,AI for Business Decisioning,Success,Completed successfully
ashrafsharara@hotmail.com,اشرف محمد متولى شرارة,اشرف محمد متولى شرارة,AI for Business Decisioning,Success,Completed successfully
enggaz@yahoo.com,محمد عبد الونيس عبد المقصود الغزالى,محمد عبد الونيس عبد المقصود الغزالى,AI for Business Decisioning,Success,Completed successfully
mohamedhussien19690@gmail.com,محمد حسين ابراهيم محمود,محمد حسين ابراهيم محمود,AI for Business Decisioning,Success,Completed successfully
noorrageb363@gmail.com,نور رجب عبد العزيز احمد رجب,نور رجب عبد العزيز احمد رجب,AI for Business Decisioning,Success,Completed successfully
